preference_id,patient_id,cuisine_preferences,flavor_preferences,texture_preferences,temperature_preferences,meal_timing_preferences,portion_preferences,cultural_notes,historical_ratings,vector_text,created_at,updated_at
PREF001,P001,"['American','Mediterranean']","['savory','mild-spices']",regular,warm,early-breakfast,medium,None,"{'breakfast':4.5,'lunch':4.2,'dinner':4.8}",American Mediterranean savory mild regular warm moderate portions,2025-12-01T08:00:00Z,2025-12-17T08:00:00Z
PREF002,P002,"['Hispanic','Mexican']","['spicy','bold-flavors']",soft,warm,late-breakfast,small,Prefers authentic Hispanic cuisine,"{'breakfast':4.0,'lunch':4.5,'dinner':4.3}",Hispanic Mexican spicy bold flavors soft texture small portions,2025-12-02T09:15:00Z,2025-12-17T09:15:00Z
PREF003,P003,"['Asian','Chinese']","['savory','umami']",regular,hot,standard,large,Enjoys traditional Chinese dishes,"{'breakfast':3.8,'lunch':4.7,'dinner':4.6}",Asian Chinese savory umami hot temperature large portions traditional,2025-12-03T10:30:00Z,2025-12-17T10:30:00Z
PREF004,P004,"['Italian','Mediterranean']","['savory','herbs']",regular,warm,standard,medium,None,"{'breakfast':4.2,'lunch':4.0,'dinner':4.4}",Italian Mediterranean savory herbs gluten-free moderate portions,2025-12-04T11:45:00Z,2025-12-17T11:45:00Z
PREF005,P005,"['Middle-Eastern','Mediterranean']","['savory','aromatic']",regular,warm,standard,small,Requires halal preparation,"{'breakfast':4.6,'lunch':4.8,'dinner':4.9}",Middle Eastern Mediterranean halal savory aromatic heart-healthy,2025-12-05T13:00:00Z,2025-12-17T13:00:00Z
PREF006,P006,"['American','International']","['mild','fresh']",regular,room,late-breakfast,medium,Strictly vegan lifestyle,"{'breakfast':3.9,'lunch':4.3,'dinner':4.1}",American vegan plant-based fresh mild moderate portions ethical,2025-12-06T14:15:00Z,2025-12-17T14:15:00Z
PREF007,P007,"['American','Comfort-Food']","['bland','simple']",soft,warm,early-breakfast,small,Recovering prefers familiar foods,"{'breakfast':3.5,'lunch':3.7,'dinner':3.6}",American comfort food bland simple soft texture easy digestion,2025-12-07T15:30:00Z,2025-12-17T15:30:00Z
PREF008,P008,"['Hispanic','Mexican']","['savory','mild-spices']",regular,warm,standard,small,Diabetic-friendly preparation required,"{'breakfast':4.4,'lunch':4.2,'dinner':4.5}",Hispanic Mexican savory low-carb diabetic-friendly small portions,2025-12-08T16:45:00Z,2025-12-17T16:45:00Z
